<?xml version="1.0" encoding="UTF-8"?>
<xs:schema xmlns:xs="http://www.w3.org/2001/XMLSchema">

    <xs:element name="Students">
        <xs:complexType>
            <xs:sequence>
                <xs:element name="Student" type="StudentType" maxOccurs="unbounded"/>
            </xs:sequence>
        </xs:complexType>
        <xs:unique name="UniqueRollNo">
            <xs:selector xpath="Student"/>
            <xs:field xpath="@rollNo"/>
        </xs:unique>
    </xs:element>

    <xs:complexType name="StudentType">
        <xs:sequence>
            <xs:element name="Name" type="NameType"/>
            <xs:element name="Email" type="EmailType"/>
            <xs:element name="Phone" type="PhoneType"/>
            <xs:element name="Address" type="AddressType" maxOccurs="unbounded"/>
            <xs:element name="DOB" type="DOBType"/>
        </xs:sequence>
        <xs:attribute name="rollNo" type="xs:string" use="required"/>
    </xs:complexType>

    <xs:complexType name="NameType">
        <xs:sequence>
            <xs:element name="FirstName" type="xs:string"/>
            <xs:element name="MiddleName" type="xs:string" minOccurs="0"/> <xs:element name="LastName" type="xs:string"/>
        </xs:sequence>
    </xs:complexType>

    <xs:simpleType name="EmailType">
        <xs:restriction base="xs:string">
            <xs:pattern value="[a-zA-Z0-9._%+-]+@[a-zA-Z0-9.-]+\.[a-zA-Z]{2,}"/>
        </xs:restriction>
    </xs:simpleType>

    <xs:simpleType name="PhoneType">
        <xs:restriction base="xs:string">
            <xs:pattern value="(98|97)\d{8}"/>
        </xs:restriction>
    </xs:simpleType>

    <xs:complexType name="AddressType">
        <xs:simpleContent>
            <xs:extension base="xs:string">
                <xs:attribute name="type" use="required">
                    <xs:simpleType>
                        <xs:restriction base="xs:string">
                            <xs:enumeration value="permanent"/>
                            <xs:enumeration value="temporary"/>
                        </xs:restriction>
                    </xs:simpleType>
                </xs:attribute>
            </xs:extension>
        </xs:simpleContent>
    </xs:complexType>

    <xs:complexType name="DOBType">
        <xs:simpleContent>
            <xs:extension base="xs:date"> <xs:attribute name="type" use="required">
                    <xs:simpleType>
                        <xs:restriction base="xs:string">
                            <xs:enumeration value="AD"/>
                            <xs:enumeration value="BS"/>
                        </xs:restriction>
                    </xs:simpleType>
                </xs:attribute>
            </xs:extension>
        </xs:simpleContent>
    </xs:complexType>

</xs:schema>
